{
  "manifest_id": "MEM-MANIFEST-DEMO-001",
  "stores": [
    {
      "id": "episodic",
      "version": "v1",
      "persistent": true
    },
    {
      "id": "semantic",
      "version": "v1",
      "persistent": true
    }
  ],
  "retrieval": {
    "id": "hybrid_retriever",
    "version": "v2"
  },
  "consolidation": {
    "id": "fixed_consolidator",
    "version": "v1"
  },
  "representation": {
    "type": "evidence_graph_plus_documents",
    "version": "v1"
  },
  "management": {
    "id": "memory_manager",
    "version": "v3"
  },
  "forgetting_demotion": {
    "id": "validity_scope_policy",
    "version": "v1"
  },
  "snapshot": {
    "supported": true
  },
  "restart": {
    "supported": true,
    "no_replay_mode": true
  },
  "phi": {
    "id": "memory_pipeline",
    "version": "v3",
    "active": true
  },
  "memory_write_set": [
    "retrieval_policy",
    "consolidation_policy"
  ]
}